URL,Description,Name
https://embed.podcasts.apple.com/us/podcast/booking-your-first-zero-emissions-flight/id1593204897?i=1000576512020,"In aviation, there’s a crowd of low-carbon technologies vying for a slice of the market. On one hand, the long-haul portion of the market will likely rely on sustainable aviation fuels (SAFs) which still emit greenhouse gasses but could be offset to net-zero. On the other hand, there’s a big share of air traffic that could go completely zero-emissions with the help of batteries and hydrogen. 
So how soon could you book a ticket on a zero-emissions flight? And what routes are possible?
In this episode, Shayle talks with Jayant Mukhopadhaya, a researcher at the International Council on Clean Transportation (ICCT). Jayant recently authored two reports on electric aircraft and hydrogen aircraft. Shayle and Jayant dig in on some tough questions: 

Can electric aircraft take incremental steps into the market given the limitations of current battery energy densities? Or do they need a technology breakthrough?

How do hydrogen fuel cell, compressed hydrogen combustion, and liquid hydrogen combustion compare?

How do airports need to prepare for hydrogen fueling? Hint: Terminal-sized upgrades.


Catalyst is a co-production of Post Script Media and Canary Media.
Resources:


Canary Media: Can battery-powered airplanes decarbonize air travel? 


Canary Media: How do we clean up air travel? Fuel from fast-food grease is just the start


Bloomberg (video): Hydrogen May Be the Jet Fuel of the Future


Catalyst: A bumpy ride toward decarbonizing aviation


Catalyst is supported by Antenna Group. For 25 years, Antenna has partnered with leading clean-economy innovators to build their brands and accelerate business growth. If you're a startup, investor, enterprise, or innovation ecosystem that's creating positive change, Antenna is ready to power your impact. Visit antennagroup.com to learn more.﻿
Solar Power International and Energy Storage International are returning in-person this year as part of RE+. Come join everyone in Anaheim for the largest, B2B clean energy event in North America. Catalyst listeners can receive 15% off a full conference, non-member pass using promo code CANARY15. Register here."
https://embed.podcasts.apple.com/us/podcast/will-charging-infrastructure-be-a-bottleneck-for/id1593204897?i=1000575749896,"Electric vehicles (EVs) are moving quickly toward mass adoption. So how do we make sure that charging infrastructure keeps up?
The people who own, operate and install chargers have some big questions to answer: 

Can public chargers run a profit, and how do business models need to change to accelerate deployment?

Why is it so hard to repair broken stations?

Does it matter where we install new ones?

When will chargers be as ubiquitous and easy to use as gas stations?

In this episode, Shayle digs into these questions with colleague Cassie Bowe, partner at the venture capital firm Energy Impact Partners, where she focuses on mobility. Cassie outlines the trajectory of charger deployment over the years, comparing charger accessibility in the U.S, China and Europe. 
Shayle and Cassie cover smart charging (also known as V1G) and V2G, as well as the commodification of charging hardware. Plus, how soon we might see wireless charging and why Shayle doesn’t have an EV yet. 
Catalyst is supported by Antenna Group. For 25 years, Antenna has partnered with leading clean-economy innovators to build their brands and accelerate business growth. If you're a startup, investor, enterprise, or innovation ecosystem that's creating positive change, Antenna is ready to power your impact. Visit antennagroup.com to learn more.﻿
Solar Power International and Energy Storage International are returning in-person this year as part of RE+. Come join everyone in Anaheim for the largest, B2B clean energy event in North America. Catalyst listeners can receive 15% off a full conference, non-member pass using promo code CANARY15. Register here."
https://embed.podcasts.apple.com/us/podcast/what-the-inflation-reduction-act-of-2022-would-mean/id1593204897?i=1000575166184,"The $369 billion climate and tax bill from Sen. Joe Manchin III and Senate Majority Leader Chuck Schumer caught everyone by surprise. Democrats had abandoned their climate legislation last month after Manchin, a must-have vote for Democrats, signaled his opposition to it.
But late last week Manchin and Schumer announced they had revived the deal under a new name – The Inflation Reduction Act of 2022. If passed, it would be the most ambitious climate action in U.S. history.
And now with support from another key swing vote, Sen. Kyrsten Sinema, the bill is an important step closer to passage.
So what would the bill do?
In this episode, Shayle talks to Princeton professor Jesse Jenkins. Jesse leads the REPEAT Project, which analyzed the effects of the bill in a report released today. Overall, the bill would make clean energy cheaper and build up the capacity of climatetech industries in the U.S. and its allies across multiple sectors of the economy, including power, transportation, heavy industry and buildings. 
Shayle and Jesse walk through the key provisions in the proposed legislation and their predicted impacts, including:

Hundreds of new gigawatts of solar and wind capacity, plus new technology-neutral tax credits to support other technologies such as advanced nuclear

Building up a North American supply chain for electric vehicles (EVs)

Reducing the costs of EVs, sustainable aviation fuels, energy storage, hydrogen and more

Increased energy security for medium- and low-income households, such as installing heat pumps and insulation


Catalyst is supported by Antenna Group. For 25 years, Antenna has partnered with leading clean-economy innovators to build their brands and accelerate business growth. If you're a startup, investor, enterprise, or innovation ecosystem that's creating positive change, Antenna is ready to power your impact. Visit antennagroup.com to learn more.﻿
Solar Power International and Energy Storage International are returning in-person this year as part of RE+. Come join everyone in Anaheim for the largest, B2B clean energy event in North America. Catalyst listeners can receive 15% off a full conference, non-member pass using promo code CANARY15. Register here."
https://embed.podcasts.apple.com/us/podcast/watt-it-takes-terawatt-infrastructure-ceo-neha-palmer/id1593204897?i=1000571467265,"We're bringing you something different today. It's an episode of one of our favorite podcasts, called Watt It Takes hosted by Emily Kirsch of Powerhouse Ventures. 

We talk a lot on Catalyst about how to finance and build climatetech. What we don’t always get into are the personal stories of people who are trying to do that work.

That’s exactly what Watt It Takes does. The show tells the stories of founders who are building a zero-carbon world — their upbringings, their risks, their failures, and their breakthroughs.

This episode is about Neha Palmer, CEO of TeraWatt Infrastructure, which builds large-scale electric vehicle charging hubs for medium and heavy transport.

Tens of millions of delivery vans and semi trucks move around the clock to keep supply chains humming. These medium- and heavy-duty vehicles make up more than 25 percent of transportation emissions in the US — even though they only make up 10 percent of all vehicles on the road.

We need to electrify medium and heavy-duty vehicles to meet our climate goals. But, how do we build and operate the charging infrastructure to power them?

That charging network is exactly what TeraWatt Infrastructure is building.

TeraWatt develops, owns, and manages charging infrastructure for these large vehicles. The company integrates hardware, software, and grid services along with on-site chargers. TerraWatt has a growing portfolio of land in strategic locations across the country that enables it to build and operate that charging infrastructure.

TeraWatt brings together a team of experts from data centers, transportation logistics, and electric cars. The more complex the high-powered charging needs, the better suited TeraWatt is for the task.

Watt It Takes host Emily Kirsch sat down with Neha to learn what it takes to electrify a sector with such massive energy demand. They talked about founding TeraWatt after Neha left Google, where she was a key figure in that company's ambitious renewable energy strategy. And they discuss the unique demands of heavy-duty transportation.

Powerhouse is an innovation firm that works with leading global corporations to help them find, partner with, invest in, and acquire the most innovative startups in clean energy, mobility, and climate. Powerhouse Ventures backs seed-stage startups building innovative software to rapidly decarbonize our global energy and mobility systems. You can learn more at powerhouse.fund, and you can subscribe to our newsletter at https://www.powerhouse.fund/subscribe.

If you like the show, subscribe on Apple, Spotify or wherever you get your podcasts.

Catalyst is supported by Antenna Group. For 25 years, Antenna has partnered with leading clean-economy innovators to build their brands and accelerate business growth. If you're a startup, investor, enterprise, or innovation ecosystem that's creating positive change, Antenna is ready to power your impact. Visit antennagroup.com to learn more.﻿
Solar Power International and Energy Storage International are returning in-person this year as part of RE+. Come join everyone in Anaheim for the largest, B2B clean energy event in North America. Catalyst listeners can receive 15% off a full conference, non-member pass using promo code CANARY15. Register here."
https://embed.podcasts.apple.com/us/podcast/seeking-the-holy-grail-of-batteries/id1593204897?i=1000570683300,"If there were a holy grail of electric vehicle batteries, it would be low-weight, long-range, and fast-charging. It would last a million miles and cost less than anything produced today.
So in the booming EV battery market, what kind of battery will check all those boxes? Who will invent it? And do we really need all those features in one battery in the first place?
In this episode, Shayle talks to Sam Jaffe, vice president of battery solutions at E-Source. They trace the history of the two major competing lithium-ion chemistries: Lithium Iron (or ferrous) Phosphate (LFP) and Nickel Manganese Cobalt (NMC).
Sam and Shayle also discuss the factors that shaped this competition, like China, Tesla, and access to capital. They discuss new partnerships between battery manufacturers and automakers, including LG and GM, Samsung SDI and Stellantis, ACC and Mercedes
And they cover questions like:

Who decides which chemistries to develop — automakers or battery part manufacturers? 

Will a small number of chemistries dominate or will there be a rapid diversification of battery chemistries to meet different needs?

Is fast charging a nice-to-have or need-to-have?

Will the rising costs of battery materials, especially lithium, slow the adoption of EVs? 

Plus, Sam explains why he is no longer bearish on vehicle-to-grid (V2G) charging.
Catalyst is supported by Antenna Group. For 25 years, Antenna has partnered with leading clean-economy innovators to build their brands and accelerate business growth. If you're a startup, investor, enterprise, or innovation ecosystem that's creating positive change, Antenna is ready to power your impact. Visit antennagroup.com to learn more.﻿
Solar Power International and Energy Storage International are returning in-person this year as part of RE+. Come join everyone in Anaheim for the largest, B2B clean energy event in North America. Catalyst listeners can receive 15% off a full conference, non-member pass using promo code CANARY15. Register here."
https://embed.podcasts.apple.com/us/podcast/crossing-the-valley-of-death/id1593204897?i=1000569876501,"In climatetech, the ‘valley of death’ describes the lack of capital for newer solutions, especially those that mainstream investors view as unproven. The climate tech world is full of technologies that would be fantastic tools for fighting the climate crisis, if only they could cross this valley of death and scale.
Scott Jacobs co-founded Generate Capital in 2014 to help address this problem. In this episode Shayle talks to Scott about how to successfully finance first-of-a-kind climatetech. They cover technologies like electric bus leasing, anaerobic digesters, microgrids and EV fleet charging infrastructure.
And they dig in on:

Winning over investors who don't have the time to understand complex technologies or business models

The kinds of support, beyond capital, that first-of-a-kind technologies need from investors 

Navigating the rising cost of capital and supply chain problems

When exactly technologies have proven themselves in the eyes of investors


Catalyst is supported by Antenna Group. For 25 years, Antenna has partnered with leading clean-economy innovators to build their brands and accelerate business growth. If you're a startup, investor, enterprise, or innovation ecosystem that's creating positive change, Antenna is ready to power your impact. Visit antennagroup.com to learn more.﻿
Solar Power International and Energy Storage International are returning in-person this year as part of RE+. Come join everyone in Anaheim for the largest, B2B clean energy event in North America. Catalyst listeners can receive 15% off a full conference, non-member pass using promo code CANARY15. Register here."
https://embed.podcasts.apple.com/us/podcast/the-carbon-copy-get-ready-for-the-battery-recycling-boom/id1593204897?i=1000569121838,"On the Carbon Copy podcast this week:
It’s been over three months since Russia’s invasion of Ukraine sent shockwaves into global oil markets, causing supply constraints and skyrocketing prices. The conflict has complicated the flow of energy at a time when supply chains were already jumbled up because of Covid.
But it’s not just oil. The war is leaving its mark on all kinds of commodities, including the global supplies of minerals and metals. Geopolitical shifts are causing big spikes in the prices of lithium and nickel, two key components of the lithium-ion batteries used in electric cars.
However, this supply mess could actually be boosting a positive trend in the battery space: recycling. 
Batteries are a pillar of the zero-carbon economy, but are they truly sustainable? And will technical advancements and evolving geopolitical alliances alter the battery-based economy for the better?
Our guest is Julian Spector, a senior reporter with Canary Media. Check out his latest report on five exciting startups tackling battery recycling from different angles. And check out all of Canary’s Recycling Renewables special coverage.
The Carbon Copy is a co-production of Post Script Media and Canary Media.
Catalyst is supported by Antenna Group. For 25 years, Antenna has partnered with leading clean-economy innovators to build their brands and accelerate business growth. If you're a startup, investor, enterprise, or innovation ecosystem that's creating positive change, Antenna is ready to power your impact. Visit antennagroup.com to learn more.﻿
Solar Power International and Energy Storage International are returning in-person this year as part of RE+. Come join everyone in Anaheim for the largest, B2B clean energy event in North America. Catalyst listeners can receive 15% off a full conference, non-member pass using promo code CANARY15. Register here."
https://embed.podcasts.apple.com/us/podcast/how-to-save-a-planet-spark-tank-how-do-we-solve/id1593204897?i=1000568417966,"It’s shark week! Or ‘spark’ week? Today we’re bringing you an episode of How to Save a Planet, in which Shayle steps into the shoes of a Shark Tank-style judge.
This episode is all about (drum-roll please): Storage!
...Exciting, right? Ok, we’ll prove it to you. Each day, more and more of our electricity comes from intermittent renewables like wind and solar. To balance out our electric grid in the future, we’ll need new ways of storing extra energy, so we can still turn on our lights when the wind isn’t blowing and the sun isn’t shining. This week, with help from Dr. Leah Stokes and Shayle Kann, we explore the wild world of energy storage, from a hidden underground lair to a piping hot thermos full of poison. And did we mention it’s a gameshow?
Guests


Dr. Leah Stokes, Professor of Climate and Energy Policy at University of California, Santa Barbara


Shayle Kann, Climate Tech Investor at Energy Impact Partners

Len Greene, Director of Government Affairs and Communications, FirstLight Power


Curtis VanWalleghem, CEO of Hydrostor


Dr. Cristina Prieto, Professor of Engineering at the University of Seville

Calls to Action

Learn more about energy storage

Pumped Hydro

Compressed Air

Molten Salts

And for a really wild one: check out Energy Vault


Learn more about our electric grid, with our episodes How We Got our Grid and How We Get a Better One and Party Like It’s 2035


We still want to see your climate Venn diagrams! For inspiration, check out ClimateVenn.info. Post your diagram to Instagram and tag us at @how2saveaplanet. We’ll be reposting examples listeners share with us.


Check out our Calls to Action archive for all of the actions we've recommended on the show. Send us your ideas or feedback with our Listener Mail Form. Sign up for our newsletter here. And follow us on Twitter and Instagram.
This episode of How to Save a Planet was produced by Daniel Ackerman. The rest of our reporting and producing team includes Kendra Pierre-Louis, Rachel Waldholz and Anna Ladd. Our supervising producer is Matthew Shilts. Our editor is Caitlin Kenney. Our intern is Janae Morris. Sound design and mixing by Peter Leonard with original music from Emma Munger. Our fact checker for this episode was James Gaines.

Catalyst is supported by Antenna Group. For 25 years, Antenna has partnered with leading clean-economy innovators to build their brands and accelerate business growth. If you're a startup, investor, enterprise, or innovation ecosystem that's creating positive change, Antenna is ready to power your impact. Visit antennagroup.com to learn more.
﻿
Solar Power International and Energy Storage International are returning in-person this year as part of RE+. Come join everyone in Anaheim for the largest, B2B clean energy event in North America. Catalyst listeners can receive 15% off a full conference, non-member pass using promo code CANARY15. Register here."
https://embed.podcasts.apple.com/us/podcast/which-tech-is-overhyped-underhyped-and-just-right/id1593204897?i=1000567474564,"Within the climate tech world, technology hype is all over the map. In this episode, Lara Pierpoint, director of climate at Actuate, and Stephen Lacey, host of The Carbon Copy and executive producer of Catalyst, join Shayle for a game of “buy sell hold.” They take bets on which technologies are either overhyped, underhyped or just right.
They cover a range of topics, including:


Advanced nuclear, including the Nuclear Regulatory Commission’s rejection of Oklo’s reactor designs and shifting opinions around nuclear


Whether the concern around hydrogen leakage and its greenhouse effect is overblown

Heat pumps, including the Biden administration’s efforts to boost production with the National Defense Production Act and a new report on how a proposed federal program to incentivize heat pumps could save Americans over $27 billion

Non-lithium-ion batteries for stationary storage, which may see an opening in the market as lithium-ion batteries become expensive due to rising commodity prices and backedup supply chains.

The state of vehicle-to-grid (V2G) technologies and fleet electrification


Battery recycling, which is picking up speed due to concerns about the environmental impact of production and a shortage of materials

Whether web3- and crypto-climate startups are solving the right problem


Catalyst is brought to you by Arcadia. Arcadia allows innovators, businesses and communities to break the fossil fuel monopoly through its technology platform, Arc. Join Arcadia’s mission and find out how you or your business can help turn a fully decarbonized grid into a reality at arca​dia​.com/​c​a​t​alyst.
Catalyst is supported by Advanced Energy Economy. AEE is on the front lines of transforming policy that accelerates the move to 100 percent clean energy and electrified transportation in America. To learn how your business can play a key role in transforming policy and expanding markets, visit aee​.net/join."
https://embed.podcasts.apple.com/us/podcast/making-sense-of-solar-engineering/id1593204897?i=1000566618181,"In some climate circles, solar geoengineering is akin to a swear word. Also known as solar radiation modification (SRM), it means deliberately modifying the earth’s atmosphere to reflect solar radiation. It provokes forceful pushback, because it’s unclear how it would affect the earth’s agriculture, ozone layer and ecosystems.
But it’s been attracting interest because it’s clear it would do one thing well: cool the planet.
If we’re not moving fast enough on emissions reductions and carbon removal to avoid 1.5 degrees Celsius of warming, could solar geoengineering, despite its risks, be less dangerous than a hotter world?
In this episode, Shayle talks to Dan Visioni, a climate modeler who studies solar geoengineering at Cornell University’s Sibley School of Mechanical and Aerospace Engineering.
They discuss what solar geoengineering might look like in the real world. 
Stratospheric sulfate injections would mimic the effects of volcanic eruptions like Mount Pinatubo in 1991, which cooled the planet by 0.5 degrees Celsius in the following year. 
Marine cloud brightening would use salt aerosols to brighten a type of cloud that reflects solar radiation, a phenomenon already created by ocean-going ships.
They also cover cirrus cloud thinning and—straight out of a sci-fi movie—space mirrors.
They explore key questions, such as:

What do we know about the potential effects on ozone, precipitation and ecosystems? What do we need to research and what could we learn by testing?

Which could scale faster—Carbon dioxide removal or solar geoengineering? 

Solar geoengineering could cost a tiny fraction of the amount required to scale up CDR. Does that mean it could buy us time to draw down emissions more cheaply? Or does the relative affordability enable a rogue actor to deploy it without international collaboration?

And who gets to decide whether the world deploys solar geoengineering? Whose hand is on the thermostat, so to speak?

Links:

Nobel prize winner Paul Crutzen’s influential 2006 paper on stratospheric sulfur injection

A provocative New York Times Op-Ed promoting geoengineering from David Keith, professor of applied physics and public policy at Harvard who studies geoengineering

Catalyst is brought to you by Arcadia. Arcadia allows innovators, businesses and communities to break the fossil fuel monopoly through its technology platform, Arc. Join Arcadia’s mission and find out how you or your business can help turn a fully decarbonized grid into a reality at arca​dia​.com/​c​a​t​alyst.
Catalyst is supported by Advanced Energy Economy. AEE is on the front lines of transforming policy that accelerates the move to 100 percent clean energy and electrified transportation in America. To learn how your business can play a key role in transforming policy and expanding markets, visit aee​.net/join."
https://embed.podcasts.apple.com/us/podcast/introducing-climavores-a-new-show-about-food-and-climate/id1593204897?i=1000566283241,"We're presenting a trailer for a new show from Post Script Media, called Climavores.
Climavores is a show for eaters who don’t want to cook the planet. Each week, journalists Tamar Haspel and Mike Grunwald explore the complicated, confusing, and surprising relationship between food and the environment. 
Episodes drop on June 21. Subscribe on Apple, Spotify, or anywhere you listen to podcasts."
